{
  "vct": "eu.we-build:ownership:1",
  "iss": "https://issuer.example.com",
  "iat": 1736935200,
  "exp": 1768471200,
  "issuing_entity": "did:example:legal-entity-789",
  "attestation_legal_category": "EAA",
  "schema_version": "0.8.0",
  "trust_anchor_url": "https://trust.webuildconsortium.eu/anchors/eidas-tl",
  "owner": [
    {
      "type": "Person",
      "jurisdiction": "DE",
      "person": {
        "first_name": "Anna",
        "surname": "Schmidt",
        "birth_date": "1978-04-15"
      },
      "address": {
        "street": "Hauptstrasse",
        "house_number": "12",
        "locality": "Berlin",
        "region": "Berlin",
        "postal_code": "10115",
        "country": "DE"
      },
      "interests": {
        "type": [
          "shareholding"
        ],
        "level": "direct",
        "percentage": 51.0,
        "quantity": 51000,
        "class": "ordinary",
        "rights": [
          "dividend_rights",
          "liquidation_rights"
        ]
      },
      "effective_date": "2018-03-01",
      "evidence": [
        {
          "id": "src-001",
          "type": "officialRegister",
          "url": "https://example.com/docs/shareholder-register-2024.pdf"
        }
      ]
    },
    {
      "type": "Entity",
      "jurisdiction": "DE",
      "entity": {
        "category": "legal_entity",
        "name": "Holding GmbH",
        "identifier": {
          "euid": "DE-HRB-654321",
          "lei": "529900T8BM49AURSDO55",
          "tax": "DE987654321"
        },
        "jurisdiction": "DE",
        "form": "private_company",
        "legal_form": "GmbH"
      },
      "address": {
        "street": "Musterstrasse",
        "house_number": "45",
        "locality": "Frankfurt",
        "region": "Hessen",
        "postal_code": "60311",
        "country": "DE"
      },
      "interests": {
        "type": [
          "shareholding",
          "votingRights"
        ],
        "level": "indirect",
        "percentage": 30.0,
        "quantity": 30000,
        "class": "preferred",
        "rights": [
          "dividend_rights"
        ]
      },
      "effective_date": "2019-06-15",
      "evidence": [
        {
          "id": "src-002",
          "type": "shareholderAgreement",
          "url": "https://example.com/docs/shareholder-agreement-2019.pdf"
        }
      ]
    },
    {
      "type": "Entity",
      "jurisdiction": "LU",
      "entity": {
        "category": "legal_arrangement",
        "name": "Schmidt Family Trust",
        "identifier": {
          "lei": "549300ABCDEF12345678"
        },
        "jurisdiction": "LU",
        "form": "trust",
        "subtype_info": {
          "settlement": "Settled under Luxembourg trust law on 2015-03-01",
          "purpose": "Family wealth management and succession planning",
          "assets": "Real estate, securities portfolios, and cash holdings",
          "reason_for_registration": "Registered for tax transparency under CRS"
        }
      },
      "address": {
        "street": "Rue de la For\u00eat",
        "house_number": "7",
        "locality": "Luxembourg",
        "region": "Luxembourg",
        "postal_code": "L-1234",
        "country": "LU"
      },
      "interests": {
        "type": [
          "beneficiaryOfLegalArrangement",
          "economicBeneficiary"
        ],
        "level": "indirect",
        "percentage": 19.0,
        "quantity": 0,
        "rights": [
          "dividend_rights",
          "liquidation_rights"
        ]
      },
      "effective_date": "2015-03-01",
      "evidence": [
        {
          "id": "src-003",
          "type": "trustDeed",
          "url": "https://example.com/docs/trust-deed-2015.pdf"
        }
      ]
    }
  ],
  "status": {
    "type": "status-list",
    "status_list_credential": "https://issuer.example.com/status/ownership/2025",
    "status_list_index": 456,
    "status_purpose": "revocation"
  },
  "cnf": {
    "jwk": {
      "kty": "EC",
      "crv": "P-256",
      "x": "TCAER19Zvu3OHF4j4W4vfSVoHIP1ILilDls7vCeGemc",
      "y": "ZxjiWWbZMQGHVWKVQ4hbSIirsVfuecCE6t4jT9F2HZQ"
    }
  }
}